<?xml-stylesheet type="text/xsl" href="transform.xsl"?>
<index xmlns:xsi="http://www.w3.org/2001/XMLSchema-instance" xsi:noNamespaceSchemaLocation="index.xsd">
<indexGroup>

<entry>
<term>aaa</term>
<finders>
<group>
<start>
<paragraph>ch01.xhtml#p1</paragraph>
<page>1</page>
</start>
<end>
<paragraph>ch01.xhtml#p1</paragraph>
<page>1</page>
</end>
</group>
</finders>
</entry>
</indexGroup>
</index><?xml-stylesheet type="text/xsl" href="transform.xsl"?>
<index xmlns:xsi="http://www.w3.org/2001/XMLSchema-instance" xsi:noNamespaceSchemaLocation="index.xsd">
<indexGroup>

<entry>
<term>aaa</term>
<finders>
<group>
<start>
<paragraph>ch01.xhtml#p1</paragraph>
<page>1</page>
</start>
<end>
<paragraph>ch01.xhtml#p1</paragraph>
<page>1</page>
</end>
</group>
</finders>
</entry>
</indexGroup>
</index>