<?xml-stylesheet type="text/xsl" href="../common/transform.xsl"?>
<index xmlns:xsi="http://www.w3.org/2001/XMLSchema-instance" xsi:noNamespaceSchemaLocation="../common/index.xsd">
<indexGroup>

<entry>
<term>amortizing loan</term>
<finders>
<group>
<start>
<paragraph>ch02.xhtml#p2_91</paragraph>
<page>23</page>
</start>
<end>
<paragraph></paragraph>
<page>0</page>
</end>
</group>
<group>
<start>
<paragraph>ch0k.xhtml#1</paragraph>
<page>42</page>
</start>
<end>
<paragraph></paragraph>
<page>0</page>
</end>
</group>
</finders>
</entry>

<entry>
<term>annual percentage rate</term>
<finders>
<group>
<start>
<paragraph>ch02.xhtml#p2_91</paragraph>
<page>23</page>
</start>
<end>
<paragraph></paragraph>
<page>0</page>
</end>
</group>
<group>
<start>
<paragraph>ch02.xhtml#p2_111</paragraph>
<page>30</page>
</start>
<end>
<paragraph></paragraph>
<page>0</page>
</end>
</group>
<group>
<start>
<paragraph>ch03.xhtml#p3_30</paragraph>
<page>42</page>
</start>
<end>
<paragraph></paragraph>
<page>0</page>
</end>
</group>
</finders>
</entry>

<entry>
<term>annuity, in buyout offer example</term>
<finders>
<group>
<start>
<paragraph>ch0f.xhtml#2</paragraph>
<page>26</page>
</start>
<end>
<paragraph></paragraph>
<page>0</page>
</end>
</group>
</finders>
</entry>

<entry>
<term>annuity, compared with perpetuity</term>
<finders>
<group>
<start>
<paragraph>ch0e.xhtml#3</paragraph>
<page>27</page>
</start>
<end>
<paragraph></paragraph>
<page>0</page>
</end>
</group>
</finders>
</entry>

<entry>
<term>annuity, construction of</term>
<finders>
<group>
<start>
<paragraph>ch02.xhtml#p2_75</paragraph>
<page>21</page>
</start>
<end>
<paragraph></paragraph>
<page>0</page>
</end>
</group>
</finders>
</entry>

<entry>
<term>annuity, definition of</term>
<finders>
<group>
<start>
<paragraph>ch02.xhtml#p2_33</paragraph>
<page>10</page>
</start>
<end>
<paragraph></paragraph>
<page>0</page>
</end>
</group>
<group>
<start>
<paragraph>ch0e.xhtml#2</paragraph>
<page>21</page>
</start>
<end>
<paragraph></paragraph>
<page>0</page>
</end>
</group>
<group>
<start>
<paragraph>ch0k.xhtml#3</paragraph>
<page>42</page>
</start>
<end>
<paragraph></paragraph>
<page>0</page>
</end>
</group>
</finders>
</entry>

<entry>
<term>annuity, mortgage as</term>
<finders>
<group>
<start>
<paragraph>ch02.xhtml#p2_90</paragraph>
<page>23</page>
</start>
<end>
<paragraph></paragraph>
<page>0</page>
</end>
</group>
</finders>
</entry>

<entry>
<term>annuity, present value derivation for</term>
<finders>
<group>
<start>
<paragraph>ch02.xhtml#p2_33</paragraph>
<page>10</page>
</start>
<end>
<paragraph></paragraph>
<page>0</page>
</end>
</group>
<group>
<start>
<paragraph>ch02.xhtml#p2_74</paragraph>
<page>21</page>
</start>
<end>
<paragraph></paragraph>
<page>0</page>
</end>
</group>
<group>
<start>
<paragraph>ch02.xhtml#p2_81</paragraph>
<page>22</page>
</start>
<end>
<paragraph></paragraph>
<page>0</page>
</end>
</group>
</finders>
</entry>

<entry>
<term>annuity factor (PV factor)</term>
<finders>
<group>
<start>
<paragraph>ch02.xhtml#p2_80</paragraph>
<page>22</page>
</start>
<end>
<paragraph></paragraph>
<page>0</page>
</end>
</group>
<group>
<start>
<paragraph>ch0k.xhtml#4</paragraph>
<page>42</page>
</start>
<end>
<paragraph></paragraph>
<page>0</page>
</end>
</group>
</finders>
</entry>
</indexGroup>
</index>