<?xml-stylesheet type="text/xsl" href="transform.xsl"?>


<index xmlns:xsi="http://www.w3.org/2001/XMLSchema-instance"
 xsi:noNamespaceSchemaLocation="index.xsd">
<indexGroup>
    <entry>
<term>Add</term>
<finders>
<group>
<start>
<paragraph>p1_3</paragraph>
<page>1</page>
</start>
<end>
<paragraph>0</paragraph>
<page>0</page>
</end>
</group>
<group>
<start>
<paragraph>p2_2</paragraph>
<page>4</page>
</start>
<end>
<paragraph>p2_5</paragraph>
<page>5</page>
</end>
</group>
</finders>
    </entry>


<entry>
<term>Anvil</term>
<finders>
<group>
<start>
<paragraph>p2_22</paragraph>
<page>15</page>
</start>
<end>
<paragraph>0</paragraph>
<page>0</page>
</end>
</group>
</finders>
</entry>

<entry>
<term>Axe</term>
<finders>
<group>
<start>
<paragraph>p1_4</paragraph>
<page>2</page>
</start>
<end>
<paragraph>p1_6</paragraph>
<page>3</page>
</end>
</group>
<group>
<start>
<paragraph>p2_22</paragraph>
<page>15</page>
</start>
<end>
<paragraph>0</paragraph>
<page>0</page>
</end>
</group>
<group>
<start>
<paragraph>p2_30</paragraph>
<page>22</page>
</start>
<end>
<paragraph>p2_40</paragraph>
<page>24</page>
</end>
</group>
</finders>
</entry>
</indexGroup>
</index>
