<?xml-stylesheet type="text/xsl" href="../common/transform.xsl"?>
<index xmlns:xsi="http://www.w3.org/2001/XMLSchema-instance" xsi:noNamespaceSchemaLocation="../common/index.xsd">
<indexGroup>

<entry>
<term>amortizing loan, </term>
<finders>
<group>
<start>
<paragraph>ch02.xhtml#p2_9</paragraph>
<page>23</page>
</start>
<end>
<paragraph></paragraph>
<page>0</page>
</end>
</group>
<group>
<start>
<paragraph>ch0k.xhtml#1</paragraph>
<page>42</page>
</start>
<end>
<paragraph></paragraph>
<page>0</page>
</end>
</group>
</finders>
</entry>

<entry>
<term>annuity, present value derivation for</term>
<finders>
<group>
<start>
<paragraph>ch02.xhtml#p2_33</paragraph>
<page>10</page>
</start>
<end>
<paragraph></paragraph>
<page>0</page>
</end>
</group>
<group>
<start>
<paragraph>ch02.xhtml#p2_74</paragraph>
<page>21</page>
</start>
<end>
<paragraph></paragraph>
<page>0</page>
</end>
</group>
<group>
<start>
<paragraph>ch02.xhtml#p2_81</paragraph>
<page>22</page>
</start>
<end>
<paragraph></paragraph>
<page>0</page>
</end>
</group>
</finders>
</entry>
</indexGroup>

<indexGroup>

<entry>
<term>bank loans</term>
<finders>
<group>
<start>
<paragraph>ch01.xhtml#p1_2</paragraph>
<page>3</page>
</start>
<end>
<paragraph></paragraph>
<page>0</page>
</end>
</group>
</finders>
</entry>

<entry>
<term>buyout offer example</term>
<finders>
<group>
<start>
<paragraph>ch0f.xhtml#2</paragraph>
<page>26</page>
</start>
<end>
<paragraph></paragraph>
<page>0</page>
</end>
</group>
</finders>
</entry>
</indexGroup>
</index><?xml-stylesheet type="text/xsl" href="../common/transform.xsl"?>
<index xmlns:xsi="http://www.w3.org/2001/XMLSchema-instance" xsi:noNamespaceSchemaLocation="../common/index.xsd">
<indexGroup>

<entry>
<term>amortizing loan</term>
<finders>
<group>
<start>
<paragraph>ch0a.xhtml#pa</paragraph>
<page>a</page>
</start>
<end>
<paragraph></paragraph>
<page>a</page>
</end>
</group>
</finders>
</entry>
</indexGroup>
</index>