
<index xmlns:xsi="http://www.w3.org/2001/XMLSchema-instance" xsi:noNamespaceSchemaLocation="../common/index.xsd">
<indexGroup>

<entry>
<term>Award</term>
<finders>
<group>
<start>
<paragraph>ch01.xhtml#p1_1</paragraph>
<page>1</page>
</start>
<end>
<paragraph></paragraph>
<page>0</page>
</end>
</group>
</finders>
</entry>

<entry>
<term>Awl</term>
<finders>
<group>
<start>
<paragraph>ch00.xhtml#_kt5</paragraph>
<page>33</page>
</start>
<end>
<paragraph></paragraph>
<page>0</page>
</end>
</group>
</finders>
</entry>
</indexGroup>

 <indexGroup> 

<entry>
<term>Dog</term>
<finders>
<group>
<start>
<paragraph>ch02.xhtml#p2_2</paragraph>
<page>3</page>
</start>
<end>
<paragraph>ch02.xhtml#p2_10</paragraph>
<page>5</page>
</end>
</group>
</finders>
</entry>
</indexGroup>
</index>